{
    "name": "data-management",
    "version": 25.1,
    "parameters": {
        "PARAM_2": "value-2",
        "PARAM_6": "value-6"
    },
    "applications": [
        {
            "appName": "crm",
            "parameters": {
                "PARAM_1": "value-1",
                "PARAM_5": "value-5"
            }
        },
        {
            "appName": "cloud",
            "parameters": {
                "PARAM_3": "value-3",
                "PARAM_4": "value-4"
            }
        }
    ]
}